{
  "id": "story-1",
  "title": "企業セキュリティの脅威",
  "description": "あなたはセキュリティエンジニアとして、企業ネットワークに侵入の兆候を発見します。",
  "chapters": [
    {
      "id": 1,
      "title": "侵入の兆候",
      "content": "あなたはセキュリティエンジニアとして、企業のネットワーク監視システムをチェックしています。\n\n突然、異常なトラフィックパターンが検出されました。通常とは異なる時間帯に、外部からの大量の接続試行が記録されています。\n\n「これは...」あなたは画面を見つめながら考えます。",
      "choices": [
        {
          "id": "choice-1-1",
          "text": "ログを詳しく確認する",
          "nextChapter": 2,
          "effects": {
            "knowledge": 10
          }
        },
        {
          "id": "choice-1-2",
          "text": "上司に報告する",
          "nextChapter": 2,
          "effects": {
            "knowledge": 5
          }
        }
      ]
    },
    {
      "id": 2,
      "title": "ログ分析",
      "content": "ログを詳しく分析すると、複数のIPアドレスから同じユーザーアカウントへのログイン試行が行われていることがわかりました。\n\nこれは典型的なブルートフォース攻撃のパターンです。",
      "choices": [
        {
          "id": "choice-2-1",
          "text": "該当IPアドレスをブロックする",
          "nextChapter": 3,
          "effects": {
            "knowledge": 15
          }
        },
        {
          "id": "choice-2-2",
          "text": "さらに調査を続ける",
          "nextChapter": 3,
          "effects": {
            "knowledge": 20
          }
        }
      ]
    },
    {
      "id": 3,
      "title": "攻撃の拡大",
      "content": "調査を続けると、攻撃は単なるブルートフォース攻撃ではなく、より巧妙な手法が使われていることがわかりました。\n\nSQLインジェクションの試行も検出されています。",
      "choices": [
        {
          "id": "choice-3-1",
          "text": "Webアプリケーションのログを確認する",
          "nextChapter": 4,
          "effects": {
            "knowledge": 25
          }
        },
        {
          "id": "choice-3-2",
          "text": "データベースサーバーを確認する",
          "nextChapter": 4,
          "effects": {
            "knowledge": 20
          }
        }
      ]
    },
    {
      "id": 4,
      "title": "脆弱性の発見",
      "content": "Webアプリケーションのログを確認すると、SQLインジェクション攻撃が成功している可能性があります。\n\nデータベースへの不正なクエリが実行されている痕跡が見つかりました。",
      "choices": [
        {
          "id": "choice-4-1",
          "text": "データベースのバックアップを確認する",
          "nextChapter": 5,
          "effects": {
            "knowledge": 30
          }
        },
        {
          "id": "choice-4-2",
          "text": "影響を受けたデータを特定する",
          "nextChapter": 5,
          "effects": {
            "knowledge": 35
          }
        }
      ]
    },
    {
      "id": 5,
      "title": "解決",
      "content": "あなたの迅速な対応により、攻撃は阻止されました。\n\n影響を受けたデータは特定され、適切な対策が講じられました。\n\nこの経験から、セキュリティの重要性を改めて実感しました。",
      "choices": []
    }
  ]
}

